,message,isMisogynistic
0,Do you have the skin of a 80 year old grandma? Worry no more,False
1,1,False
2,Honestly my favorite thing about this is that they feel the need to cite beauty professionals in order to prove that dehydration is caused by not drinking enough water.,False
3,Source? Doesnt sound right to me idk,False
4,Damn,True
5,(1,False
6,Some places have poor water quality. Virgin blood may have been less expensive than imported water.,False
7,So if I drink enough water I turn into a baby?,False
8,You'll Benjamin Button yourself,False
9,Isn't this the plot of Cocoon?,False
10,No idea. I watched the movie 10 years or so ago with my dad and all I can remember are the doctors being shocked that the lady was pregnant ,False
11,In the movie there is this group of elderly that discover that they feel suspiciously rejuvenated by going for a bath in a special swimming pool. I was just being silly with the water/de-aging association.,False
12,One of my friends looks like he's frikkin dead. Been trying for years to pour water down his throat and get him to wash his face. Recently won the face washing battle and he looks 5 years younger.,False
13,What kinda Tom Brady nonsense is this,False
14,Recommended by F.F,False
15,Professionals say,False
16,Virgina Spread ,False
17,*I can't believe it's not* virgina spread open,False
18,I hate you because its the middle of the night and Im silently suffering from laughter but your updoot,False
19,Even if you chug a handle of bad vodka and give this person the benefit of the doubt,False
20,I'll need *way* more than vodka to make sense of this shit,False
21,I think I have a couple more handles in the garage but they're warm,False
22,Well now the secrets out,False
23,"I know you've been doing it with the neighbor. Shake your ass.""""""",False
24," 4)""",False
25,r/ihadastroke ...?,False
26,(2,False
27,When you think its butter,False
28," 6)""",False
29,I've read this 10 times and I still don't fully understand what that person is saying..?,False
30,Who are they?,False
31,What?,False
32,am I the only one who instantly thinks of the super Bowl halftime while reading this?,False
33,never look on the bright side of life,False
34,Bcaause being happy for your brother becoming a dad is off the table,False
35,Dude,False
36,(3,False
37,17-02-2020,False
38,Classic Ed Kempercel ,False
39,I thought that's who that was,False
40,at first i was really scared this was going to be something pedophilic and incestuous,False
42,Here's a solution : Show this post to your brother,False
43,Given that he wants to be associated to one of the sickest of the serial killers out there by his avatar,False
44,My two favorite things about this post are how he unnecessarily details his future niece's ethnic makeup and how he shows his work at the end.,False
45,I feel sad for him. He's 22 and already giving up on love and life. I hope that someone can talk to him and get him some help.,False
46,Don't feel too sad,False
47,"Another Vogoncel: """"If your ugly because of a disease",False
48,Will remake so its better later ,False
49,I don't believe that,False
50," 2)""",False
51,"Vogoncel"""".That made laugh way too loud.""",False
52,I again have to laugh at these idiots REEEEEEEE'ing about single mothers on welfare while demanding government-subsidized plastic surgery.,False
53,You can almost sing this to the theme song of the kid's TV show Arthur,False
54,I just reread that,False
55,If YOUR ugly YOUR ugly,False
56,But remember,False
57,(4,False
58," 8)""",True
60,"Did he title this one """"Jealousy""""?""",False
61,i have never heard vogoncel omg why,False
62,Like listening to a mysoginistic leprechaun spin rhymes,False
63,God is the reason your personality sucks. I mean,False
64,Personally I'd say God made the right call sticking you where you deserve to be.,False
65,You know most of these people are mentally ill guys hanging in the wrong crowd. Most of them don't know any better and are only this stubborn because it's the only kind of positive afferment they get from each other. None of them deserve hate or to be made fun of. They just need a bit of pushy help.,False
66,I'm mentally ill too and spent almost my entire teenage years with the same douchebag view on women,False
67,Aren't you super high IQ? Use that big brain,False
68,Plot twist he actually does,False
69,I'm personally an atheist,False
70,I would not say that by women getting rights is a test by God. Id say its basic human right.,False
71,(5,False
72, 4,False
73,Yes.  Rights are like pie. If you have some,False
74,oh noes! oh woe is me! why was i born on a time where the other half of humanity have rights after fighting so long for them! oh the horror! i weep for humanity!,False
75,Oh,False
76,Were dew-ritos a thing back then? Dang,False
77,So sad I wasn't born one hundred years ago,False
78,Women have rights,False
79,[Journalism]Nintendo Life extends an olive branch for Pete Davison with a freelancer review for Prison Princess.,False
80,Thecontext of the situation is that Pete previously wrote an article protesting Pat'o'Reilly's negative panning of more niche titles. Gun Gun Pixies was the last straw for him and it was likely that Nintendo Life took notice and offered Pete a chance to provide more positive coverage of such titles.,False
81,You mean to tell me that the in-house writers for lots of these websites hate these types of titles and almost universally pan them? I'm more shocked they actually reached out to a freelancer to give this title a fair shake,False
82,The guy who wrote GGP's review wasnt  a lonely cismale feminist ally  but a dad who while enjoys Japanese games,False
83,Noisy pixel did a good review of it,False
84, 1,False
86,I read this review earlier today and actually thought it was very fair and reasonable. This is good to see. Hopefully this is a sign of things to come.,False
87,(6,False
88,Good guy Nintendo Life.,False
89,Unequal bathrooms. Smh.,False
90,Easy,False
91,Modern problems require modern solutions.,False
93, 2,True
95," 3)""",False
96,If you ever hear someone say that,False
97,Nothing stopping women from peeing standing up.  They could they choose not to.,False
98,If this is at a university you can always file a title IX complaint.,False
99,Institutionalized sexism hurting men.,False
100,"Liked the video but cringed when he said """"smh"""".""",False
101, 6,False
103,I Literally use the womens restroom EVERY time in this scenario.  Nearly everywhere i go has this too,False
104,Because men don't deserve privacy apparently.,False
105, 8,False
106," 9)""",False
107, I'm a man. I can hold it until I get home,False
108," 11)""",False
109,No. Its that they dont trust US.,False
110, 11,False
111," do you think the DAs would have to be inventing ones that don't exist?""",False
112,See given the chance a man will rape thousands...oh wait.,False
113,how do you even rape 1000 women. i mean thats a lot of people. 100,False
114,The same thing happened to former OKC police officer Daniel Holtzclaw but he was convicted and sentenced to 263 years in prison based on nothing more than the testimony of prostitutes and drug addicts.,False
115,Holtzclaw was a rapist.  His dna was found in places it shouldn't have been if he was honest,False
116,"There's no way he would want to have sex with those ugly ghetto whores.One of them claimed her assailant was a short black man which Holtzclaw obviously isn't.The only DNA was from convicted criminal Adaira Gardner who told her mom she wanted to go out with Holtzclaw because he was a """"hot cop."""" The case is a fucking fraud.""",True
118,Didnt Cosby admit to drugging women though?,False
119,(9,False
121,Not so fast. Read the accounts from the women. The good doctor clearly has connections which got the charges dropped. Look,False
122,Unless you are black you don't go to jail for having a little bit of drugs or guns in America,False
124,LMFAO!!! Well it looks like their attempts to censor freedom of speech is backfiring!!! I never heard of this subreddit until the quarantine! and here I am!!!! LMAO!!!! VICTORY!!!!!!!!,False
125,This quarantine is probably for the best as it gives us more privacy.,False
126,On the other hand,False
127,I hate when trying to have a conversation about something and all the responses are he hates women,False
128,Going your own way as a guy is highly offensive apparently. When a women goes her own way... you go girl! A women doesnt always need a man,False
129,"They loving shaming us with insults """"Incels!"""" or taunts """"Man up!""""  It takes courage to just keep walking",False
130,Yeah. Like a fish a bicycle. The fish term fits on so many levels.,False
131,If I knew how to I would open my own subreddit called... Men boycotting woke women. Just to see how they respond to that!!!,True
132, 3,False
133,LMFAO,False
137,[removed],False
138,Oh boy you sure got him!,False
139,Better to be a virgin than raped in court.,False
140,Go woke go broke.,False
142,That's a weird way of trying to get someone to fuck you...,False
143,[Code Purple](https://exposingfeminism.wordpress.com/shaming-tactics/),False
144,Lol I can tell your just a mad women who thinks she is entitled to marriage. Awwww has someone past their prime and now regretting the cock carousel ride they took .,True
145,HAHA! Yeah,False
146,I just joined. Better late than never.,False
147,Welcome.,False
148,Anyone knows what's the user count? Now it just shows 0,False
149,Before the quarantine it was about 160,False
150,And this are only the community joined user.,False
151,I only felt motivated to post after the quarantine so good work reddit,False
152,Same here.,False
153,assuming half mil to a mil.,False
154,Welcome. Read and learn,False
155,Uno reverse card,False
156,Honey,False
158,This happened in 1996. If this was 2020 the judge would let her keep the ticket and still force the ex husband to pay alimony.,False
159,Let me guess. She divorced and then cashed the ticket?,False
160,Nah not quite. Won just short of 2 million in '96 (yeah,False
161,(11,False
162,You mean women marry and divorce for financial gain??? Never! /s,True
164,Is this real?,False
165,Very. I remember when it happened.,False
166,HAHAHAHAHAHAHAHAHAHAHAHA stupid cunt,True
167,justice,False
168,Name a man that did this then,False
169,")""",False
170,And they couldn't justify the quarantine with facts.  They had to use a straw man.,False
171,What was the strawman? I never got to see the reasoning,False
172,The police found some asshole who joined here and who had been searching for violXXt topics that had to do with terrXXism.  So reddit takes this idiot as representing this sub and uses that as an excuse to quarantine it.  They didn't point to any posts that dude made,False
173,MGTOW is in your head. That this sub exists or not,False
174,Once a red pill is swallowed ,False
175,You know the red pill is a myth right? The only true pill is the honk pill,False
176,I was mgtow before I'd even heard the term.  It is nice to have a place to discuss these ideas though.,False
178,Hunted to extinction.. That's rich.  Most MGTOW are self sufficient,False
179,I hadn't thought about that,False
181,They want our money and peace of mind. I say,True
182,"You can kill a man but you cannot kill an idea.""""""",False
183,Im almost positive reddit and vice were working together to get MGTOW labeled as white supremacists. I wouldn't be surprised. They'll do anything to silence men. I've seen posts about male suicide getting taken down,False
185,Labeling everything they don't like at this way,False
186,*First they ignore you*,False
187,So is there no way to get out of quarantine? Also can anyone post the statement given to quarantine this sub.,False
188,Yeah was surprised it took them this long to do it too.,False
189," 10)""",False
190,This is true.,False
191,Sadly never goes away,False
192,...,False
193,(13,False
196,it's sad that we need to put cameras in our houses to protect ourselves from liars,False
197,You cant win,False
199,F,False
200,U,False
201,N,False
202,Holy shit it's over.,False
203," etcall because hes worried someone will toss him a false accusation if he doesnt hear clear consent for simple interactions.....its really messed up""",False
204,Not even jews in concentration camps were psychologically destroyed to this level!,False
205,Can you imagine how much the wahmen value those laws? No wonder they hate us.,False
206,The same people who quarantined this sub would just call him an incel and tell him to man up.,False
208,my ex got me with a domestic,False
209,I know,False
210,What Cinnamon toast fuck is this?!?,False
211,Reason #143252353 to avoid women.,False
212,When i was in highschool i regretted being invisible to people,False
213," 12)""",False
214,Well this is rage fuel. A guy I worked with years ago went through something very similar. 6 months in jail. Totally wrecked his life,False
215,If a woman punches herself before lying to the police youre actually better off killing her before she reaches the phone. The first case youre 100% fucked while the second you have a chance to get away with it AND She receives a punishment regardless of whether you do.,True
216,lol,False
218,I dont think this subs for you...,False
220,And why's that? Your comment strikes me as very integrated feminist TBH. As all fascism movements exclusion is one of their main drives. Care to elaborate?,True
221,Top comment aint wrong tho,False
222,She dead. Johnny Depp is a man of great talent,False
223,2,False
224,Theres a photo circulating with his severed finger.,False
226,i have a question why did she do it,False
227,Because why not. She got popular thanks to the #MeToo movement and she is just one of the many. Now she is one of the few. For now. Let's see if she gets media crucified.,False
228,A woman is about to face consequences for her actions? Let's just move on.,False
229,How can people follow entertainment news? It's so fucking stupid.,False
230,Its female heroin.,False
231,fucking cunts. that's why tv is dead,True
232,[https://www.change.org/p/dc-entertainment-remove-amber-heard-from-aquaman-2](https://www.change.org/p/dc-entertainment-remove-amber-heard-from-aquaman-2),False
233,Just did it ,False
234,Society doesnt care for men.,False
235,Link?,False
236,[here ya go](https://youtu.be/pFWVoEHcEjw),False
238,That's f****** infuriating,False
239,Top comment NAILED it.,False
240,She tried to cut his finger off! She's pretty much into waste of oxygen territory if you ask me.,False
241,(14,False
243,https://www.reddit.com/r/PussyPass/comments/ez7c1n/top_comment_aint_wrong_tho/fgm3ujg/?utm_source=share&utm_medium=ios_app&utm_name=iossmf,False
244,"[Ethics] Independent: """"Jordan Peterson suffers year of 'absolute hell' and needs emergency treatment for drug addiction that forced him to withdraw from public life",False
245," 1)""",False
247,You don't have to like Jordan Peterson or fully agree with his views. But the kind of vitriol and hatred being spewed against him from people feigning to be all about love,False
249,Then,True
250,A few more years and they will be advocating political dissidents need to be put into camps.,False
251,We're already there with what Sanders supporters are saying.,False
252,[deleted],False
255,Whoa,False
256,There were some hints before,False
258,Experts are only experts in their field. It's why it's dangerous to blindly trust someone when they go outside their area of expertise,False
259, well everything from our diets,False
261,Typical garbage from a shitrag like the Independent. How long before those useless sacks of trash get sued for libel and defamation?,False
262,Your guess,False
263,Never.,False
266,I agree. I think bullying in adulthood usually tends to be in the form of social evasion,False
267,Ignorance is bliss,False
268,Nah. I would say that people and relations between are my hobby. I'm pretty receptive. It's not usual behaviour you see at work or in public places like metro.,False
269,Massive fucking cope holy shit. People look at others in disgust all the time.,False
270,"I have never once seen full grown adults gawk at a person because they're """"ugly."""" You guys are so full of shit it's not even funny. Or maybe this is just satire? Paranoia is a real thing. Try and realize that""",False
273,Dude shut up lmao,False
274,what makes you so certain that they were laughing at your face? thats a pretty big assumption to make..,False
276,Why are you giving him this bad advice? At least 400 showers daily are recommended. Anything less and you have nothing to complain about sweaty.,False
278,You should report this to the university,False
279,Say hello to modern adults. Degenerate manchildren. All of them. We're at the point where people will defend a grown man crying over star wars. Honestly it does not surprise me that this is real. You must have one hell of a pampered and unchallenging life to be able to act so much like a child. I honestly wish I could have this child like mentality so I could gain some confidence. Looks like many of us just grew up too fast.,False
280,PM me your pic,False
281,Is this for real? If so its appalling behaviour and completely fucking unnaceptable.,False
282,Man how can you possibly be that ugly? What aspect of you do you think is causing this? I seriously think it's in your head,False
284,'Women are the real victim of war when they have to do the jobs normally performed by men.. because all the men are dead' ,False
285,Women are victims = having to do work,False
286,How can anyone say this with a straight face is beyond me.,False
287,Even when they're dead it's still a man's fault.,False
288,Boo-fucking-hoo.,False
289,But did they die tho?,False
290,These people are absolutely insane,False
291,Well they could have fought along side or just do the fighting for the guys,False
292,Not to mention,False
293,Well,False
294,She and Hilary Clinton would get along just fine,False
295,Gah! Those pesky men and their privilege! I can't BELIEVE that I have to take out the trash on my own now - all because my selfish husband took it upon himself to take up arms to defend his family and is now rotting in a shallow grave,False
296,Unironically their thought process probably,False
297,In order words: before the war,False
298,Clown world. Absolute clown world.,False
299,"Isn't this what they wanted ? To kill """"traditional gender roles"""" or it doesn't work like that when they need to move their asses and do actual work ?""",True
300,Such a burden not being dead or dismembered the poor things.,False
301,Mental gymnastics: 100,False
302,He is unable to be a utility for me. Man bad.,False
303,Imagine telling someone youre a gender specialist while keeping a straight face.,False
304,The only TRUE RED PILL comrades. Motherland above all!,False
305,Alright slavaboo.,False
306,no.,False
307,No,False
308,Got a few girls sweet talking since the past few days hoping to get me to take them out for valentine's day. Lmfao. A day designed to cuck more simps.,False
309,I'm ghosting.,False
311,It's funny to see the hamster that starts to act up in their little widdle tiny brains after saying that too.,True
312,Oh wow,False
314,"Two more days until """"handout day"""" arrives and it is sad how men are so gullable to go along with this wallet empting tradition.""",False
315,I havent noticed anything different,False
316,Sad but true.,False
317,"Let them cry """"where have all the good men gone!?"""" Fucking dumb whores!""",True
319,You guys have been getting messages and looks? I haven't had that in years and happy for it. Stay strong guys.,False
320,Yup,False
324,A lot of women do this to their simp boyfriends and its sad,False
325,Thats why you go gray man. Especially around these times. That way,False
326,Birds Of Prey Bombs at the Box-Office,False
328,"Summary: _Andre & Tom discuss the film """"Birds of Prey"""" and the media """"blame game"""" beginning before the weekend has ended about the failure of the film and why",False
329,"They didn't go with """"blame the men"""" this time because that would still be a backhanded admission that men refused to see the movie after its marketing shat on us.  After briefly testing out """"superhero fatigue"""" and """"coronavirus panic""""",False
331,I do!,False
332,"I saw """"Assault on Arkham"""" so I didn't need to see Suicide Squad.""",False
335,*Admiral Gender Studies glares at you*,False
338,"Maybe it's because the trailers made it look like basically a female supervillian version of """"Batman And Robin""""?  Or perhaps the female supervillain version of """"Batman and Robin: The Musical?""""""",False
339,I've heard the unflattering comparisons to Batman & Robin (the film of course) come up a few times now from some pretty disparate sources. What genius looks at the entirety of Bat Family,False
340,The visuals in the marketing do look bad.  And the action showed in the marketing also looks bad.  And Harley comes off obnoxious.  There's no Joker (who is perhaps DC movie's biggest draw) and if you are focusing on Harley,False
344,Actually a lot of us comic book readers wanted a Birds of Prey movie and were happy when it was announced.  However when this movie was announced there was also Gotham City Sirens and Batgirl movie announced too.  The theory is when Sirens and Batgirl were cancelled or put on hold Harley was added to Birds of Prey due to Margot Robbies contract.,False
345,Hey she honestly did great in Suicide Sqaud,False
346,Magnum's Threesome Game and Lay Report [FR],False
347,(7,False
348,i stopped reading once he said his main girl wasnt into other girls....  only way a 3sum really works is if both girls are bi.,False
350,Seems like a common theme with people posting here.,False
353, I dance by myself and I sometimes do karaoke. I also wear my high heels which I rarely wear outside! It's not like I am able to forget how undesirable and lonely I am,False
354,youre such a wholesome person ,False
355,That's cute. :3 I try to uplift myself by cooking home-made dinners or treating myself to pancakes outside. I too wear peeling masks every once and then,False
356,Oh yes! I love cooking! I also want to try going out to eat alone! I am not that comfortable in public yet,False
357,my valentine's day present to myself will be getting my eyeliner tattooed :),False
358,I love the idea of gifting yourself on Valentine's!,False
359,lol i was planning on getting it done anyway :) the booking on the 14 was a lucky coincidence :),False
360,Haha but now you gave me a great idea! I'm buying myself some piece of jewellery or a dress as a Valentine's gift!,False
361,go treat yourself! :) now's a great time to buy jewellery cos of all the promotions anyway,False
362,in terms of self care i guess i want to go to psychotherapy or get on meds and finally get my mental health under control. i've been like a dead man walking for 8 years now and i either get healthy or die.,False
363,I love this post. I love you. Cheers to self-care <3,False
364,I like how you dress up for yourself. If I lived alone Id probably do this too,False
365,Girl rapes her sister boyfriend and tries to flip the script. Sister stood by her man,False
366,Well then,False
367,thread locked. shocker,False
369,Then why is he/she still functioning as mod? Isn't he tired?,False
370,Which apparently means believing women can rape and lie about it.,False
371,First rule of false allegation : We don't talk about false allegation !,False
372,Shit mod does shit thing while simultaneously shaming men.,False
373,A link would be nice to the thread.,False
374,[https://www.reddit.com/r/relationship\_advice/comments/f0rur0/update\_my\_younger\_sister\_19f\_and\_my\_boyfriend\_21m/](https://www.reddit.com/r/relationship_advice/comments/f0rur0/update_my_younger_sister_19f_and_my_boyfriend_21m/),False
376,Yep. Sometimes l,False
378,I guess u/budlejari couldn't stand the truth...,False
379,Im not reading all that. Im sorry. Can someone summarize?,False
380, 7,False
381,I understand the family part,False
383,That's a horribly fucked up situation. I'm not even involved here and the whole thing makes my blood boil.,False
384,Gold diggers gotta dig...,True
386,simp btfo,False
387,From r/cursedcomments,False
388,So the cum dumpsters say,True
389,Hes certainly a self-described commie but only a Jew when its intersectionally convenient for him.,False
391,Prostitution but now with a monthly subscription. Also less sex.,False
393,People in general are just bad at relationships in general. No one is perfect and every relationship will have friction to work through. That said there are many people that you should figure out arent worth investing in,False
394,(12,False
395,Women (weak people) have ZERO mercy when they have power...,True
397,Yup. Worst part is,True
399,Great post friend!,False
400,Solid post. And yes,True
401,I would go to a escort who give payment invoices to her services as a further proof that its not rape,True
402,Mother of god,False
404,This is MGTOW gold.,False
405,Excellent post.,False
408," 14)""",False
409, social media,True
413,Im not sure what you mean on the second point. Yes,True
414,Tbh its kinda weird to think about how the timeframe which women have been given full equality and that too only in first world countries is equivalent to a blink of an eye when comparing it to the amount of time humans have existed,False
415,"Why do they insist in the """"they defend women in an attempt to get laid"""" narrative?""",False
416,Because thats how they think you get laid,False
417,My wife doesn't even know my Reddit handle. She's probably never heard of incels. Still getting laid tonight. Make of that what you will.,False
418,That you're a man without kids yet?,False
419,Nope,False
420,Awesome screen name and I feel your pain on that one.,False
421,Thank you! He's our challenge. Sweetest kid in the world,False
424,What if you're a woman defending other women and you're straight?,False
426,I am married,False
