,message,isMisogynistic
863,Well dont pour Dr Pepper into your vagina,False
864,Seriously. Dr. Pepper makes everything taste bad.,False
866,I get better results with Orange Fanta in my vagina.,False
867,Ditto.,False
868,Definitely not. Pineapple juice would be worse though,False
869,That hurts my vagina and I dont even have a vagina,False
870,Waste of some good Dr. Pepper if you ask me.,False
871,don't drink this,False
872,Maybe they just didn't want to talk about how pussies can taste while browsing on Facebook?,False
873,What do think about Yuri?For me,False
874,Again I messed with the title it's what do you think not this title of what do think,False
875,yuri best girl,False
876,Yes,False
877,Y'know,False
878,Well I relate to her the most! MWAHAHAHA,False
880,Hello! Im the person you are following!,False
881,knife to meet ya.,False
882,*stabs*,False
883,Yuri is great! I think Id get along very well with her,False
884,Yeah her shyness is cute and this is an incentive to be friends with her and protect her,False
887,Yuri in her poems had complex words I think she likes philosophy and fantasy,False
888,Feel less femcel-ish in a class full of girls.Mostly a rant post. When class/hobbies/work are predominately females I dont feel ignored,False
889,I've similar experience as well. I'm studying now in a mostly female space and I feel welcome here.,False
891,I went to a girls school and I definitely feel worse outside of it.,False
893,This is my dream. Like damn,False
894,Same. Men actively exclude ugly women group discussions and then see us as cockblocks when our girl friends reject them. I try to spend time in women only spaces.,False
896,Yess. I like my workplace bc its mostly women. Its just a supportive and understanding energy all around. I dont feel anxious about being judged or anything,False
898,Just ignore thousands of years of evolution bro,False
899,Acceptance and being at peace with it,False
900,I am the blackpill,False
901,I dont hate myself. I hate everyone else(men and women).,False
902,Blackpill makes me fucking miserable,False
903,(22,False
905,Your life is yours to do with as you please I guess,False
906,Cholla cacti is unforgiving ,False
907,Where does that grow so I can never go there,False
908,Southwest US and northern Mexico. It's not a big deal,False
909,This actually happened because of the new google maps cactus hack. Bicyclists are driving into cacti everywhere. It's an epidemic. Apparently North Korea is behind it.,False
910,Good,False
911,Get out of here you Kim Jung Un Cacti sympathizer!,False
912,My boyfriend barely brushed up against one ball,False
913,Are we still doing phrasing?,False
915,As long as it is done with consent,False
916,Thankfully coyote Peterson taught me how to deal with them,False
917,Staying the fuck away from them is better dealing with them at all.,True
918,this person never dreamed of having that many pricks in them at one time.,False
919,It's called jumping cactus for a reason,False
920,Ugh I hate those things.,False
921,Why are men allowing such behaviour from women?,False
922,Because an idiot allowed her access to his property.,False
923,Though I have no sympathy for simps ,True
925,Fuck this cuck. He is a doormat.,False
926,IDK why,False
927,No man is allowing this.  If any man did this he'd be thrown in jail.  If a guy defended himself it means jail time.,False
928,Because if she say boo the police will haul him away.,True
929,Sounds like she needs to be evicted and then sued for property damage.,False
930,Hopefully ex-girlfriend.,False
931,Because they aren't men,False
932,Read the comments,False
933,Nice looking artistic wallpaper though.,False
934,Woman fuks two Chads from Tinder then complains about not finding true love.,False
938,Shes a hoe.,True
940,And the girls who don't seem like a hoe,True
941,she is on a good path and should just do the same thing the already did but try harder,False
942,"Goes on tinder and expects something other then a """"pump and dumb"""" holy shit are these people stupid.""",True
943,Women arent smart.,True
946,The hot guys she goes after arent interested in settling down. She doesnt want the men who do want to get married.,False
947,Poor girl...she has accurately described the next decade of her life. She hasn't figured out the wall yet....lol.,False
948,meeee,False
949,girl same but somehow that doesn't stop me from spending an inordinate amount of money on an intricate skincare routine,False
951,It's really disheartening to spend a lot of money on my skincare routine and still look like a river troll,False
952,ikr!!,False
954,This is interesting,False
955,I hope she enjoys her newly-earned male privilege.,False
956,LOL. Getting a taste of what so many men go through and she doesnt like it. Welcome to the world men experience every day.,False
957, Youre not going to ask for alimony,False
958,Sounds like she doesnt believe in equal rights.,False
959,On the bright side,False
960,The comments are wonderful on that thread. Calling the men leeches and all sorts of deliciousness all the while not considering how often this happens to men.,False
962,"Woah woah woah woah woah fuckin woah... Isn't that dude entitled to that money because of all the """"unpaid labour"""" he did as a house-husband? That's how it works",False
964,Shoe,False
965,They want equality but dont want to touch that provider gender role that is forced on men.,True
966,I wouldnt be surprised if Im the near future laws will be made to make alimony something only dudes pay.,False
967,Doesn't feel fair does it o well girl it's your life now.,False
968,How the turns have tabled or something,False
969,(28,False
970,Well it seems like you know how you could have handled them differently lol,False
971,How else though? Im open to ideas.,False
973,Tact? Teach me friend.,False
975,Thank you!  Ive been saying this since high school!  Guys were always working against their own interests with that slut shaming bs. and that whole telling everyone culture,False
976,Yeah it's absurd. We should all be trying to make the world as slutty of a place as possible lol,True
977,I love you,False
978, thanks bro,False
979,(29,False
981,Definitely! It can be lonely and isolating for a lot of girls.  Our job is to be the normal guy that treats them like a person ,False
982,hypothetically,False
985,Learn to be more of a touchy person. Atleast when you are in a private setting with a girl,False
990,Thank you. Will look into this. I guess I should just remember some kino moves and check off the boxes during the date.,False
993,(30,False
994,I know what you mean,False
999,People like this actually exist.,False
1001,Police need to divert resources cause her fee fees were hurt.,False
1003,Hope her local police read this!,False
1004,One woman's mysogynist is another man's freedom fighter.,True
1005,With a statement like that,False
1006,This is peak journalism.,False
1007,So... she has nothing worth stealing,False
1010,here is to hoping a transgendered negro robs her home and chimps out on her wiff a sesshual eemergency n sheeeeit,True
1011,She can say that cus with a face like that she is sure she won't be raped,True
1012,Well divorce rape is robbery so this makes perfect sense,True
1013,I'd love to see her reaction if someone emptied out her house and the cops said,False
1014,Girl in China calls cops and accuses boyfriend of having coronavirus after he fails to apologize after argument.,False
1015,Damn. Stubborn.,False
1017,That look like the same lady that was in a different thread here intentionally spitting all over the elevator buttons !,False
1018,They all look alike,True
1019,Holy shit I wonder what the punishments for filing false police reports is in China? Probably got a bullet to the head ,False
1020,She probably got at least 5 gulags.,False
1021,She is batshit crazy,False
1022,Unsure if you were making a joke about the virus starting from bats or just saying she's crazy...,False
1023,I.don't think bats have anything to do with this. She needs a long sleeved sweater that closes on the back.. and a padded room,False
1024,There was rumors that the virus originated from bats/bat saliva. This is not confirmed and me referencing it isnt me saying that i believe that's where it originated from. Was just wondering if it was clever wordplay or not.,False
1026,Imagine the police believed her given the current climate over there. He would have been fucked over majorly. People like her disgust me. Trash.,False
1028,Has breasts.,False
1029,(33,False
1030,....the ones in the middle from the second down..... wh..what,False
1031,Can't make round rotis? Roti is a dish made from wheat flour. Is that what you're asking?,False
1032,Or you mean Goa? Goa Is a party town in India.,False
1034,Also: I can swear and drink.  These are boni,False
1035,Falls in love in a park? What the what?,False
1036,Hahaha!! Yeah,False
1037,Also quick question,False
1038,The sub you mean? They're awful anti-badwomensanatomy people over there.,False
1039,Yeah.. bunch of incels. It would be funny to see how serious they're about this awful picture.,False
1040,The bottom left one,False
1041,OMG!! Now I can't see it any other way...,False
1042,I'm clearly a bad girl and it's awesome,False
1043,Where do adopted kids come from?,False
1044,(34,False
1045,Soviet research labs. All adopted kids have a wake word and God help us when Putin decides to use it.,False
1046,It's Pringles in Celtic,False
1047,Prin Aile Glaith,False
1048,So does this dude go with the stork story then? That's adorable,False
1049,I'm confused. What's happening here?,False
1050,Incel complains about women. Someone reminds him that a woman gave birth to him. Incel is dumb and says Im adopted,False
1051,He was hatched.,False
1052,Adopted kid is angry at being abandoned by his birth parents,False
1053,Found the cabbage patch kid.,False
1055,Retrads are car tires that have been reconditioned.,False
1056,Calling someone a tire ain't a bad insult,False
1057,yeah,False
1059,well said,False
1060,All the women in the Marvel movies were upped to almost godlevel powers. It was ridiculous. She wasn't even the original Captain Marvel. They completely chopped up the story to make it about a woman.,False
1062,"What Actress Would You Like To See Play Galactus?""""""",False
1063,/sigh sadly this is why I read sf/fantasy where the MC is OP.  If I was the least bit OP myself,False
1064,Marvel has been woke for a few years now which explains the desperate Captain marvel push with the constant relaunches once the book sales plummet.,False
1065,I've seen videos of guys getting fucking rekd doing this kind of work. It's fucking dangerous.,False
1066,Yep. And that's exactly why you don't see women doing it....,True
1067,2 months of equation without back up. I know it's a joke but still...,False
1068,Too good,False
1070,A question about how you knowSo Ive never had sex. I find the thought of doing it terrifying. I dont know if that makes me ace,False
1071,Hi! I know exactly what you mean,False
1072,(36,False
1075,I admire your courage for asking. Im from a conservative Christian background (. Asexuality was a word I heard when I was a teenager. It sounded like me so I asked a lot of questions and did some research. It just makes sense to me. Self-evaluate and ask questions a lot. You arent the only one who has gone through this. Were in this together.,False
1076,Thank you for your answer. Did you ever feel like your conservative background made you dislike the idea of sex? I dont know if thats a common thing that happens that I need to investigate further. If its not,False
1077,Its not offensive,False
1078,I think I might be the same as you. But isnt it difficult to find a man who is okay with never having sex? I just cant imagine any man being okay with that unless hes also ace,False
1081,Thank you for this! Its really helpful to see the perspective of someone who grew up in a more sex-positive environment. I am very doubtful that Ill be able to find a guy who is okay with dating but not sex. I see from this sub that its possible,False
1082,This is actually quite common for aces and allos alike,False
1085,Thought it belongs here,False
1086,Dont worry.  This never happened.,False
1087,this,False
1088,Is the way,False
1089,\> Thinking the real father would actually raise the son.,False
1090,Reddit hive mind is a simp mind,False
1091,I think that's what the condoms were intended to prevent.,False
1092,r/pussypassdenied,True
1093,Tbf,True
1094,Abortion? She got what she deserved,False
1096,Nice! But also - isn't that pussy pass denied?,True
1100,That's awful because when I hear that song I think of how I was living in NYC at the time and the Mets used that as their Subway Series anthem. It brings back happy memories. To know it's a song putting down women like me... :(,False
1105,I mentioned this before about a song like 24K. I remember listening to the song and vibing to it until the secongld verse came around. Leave out being smart,False
1106,The flipside is all the songs praising 'beautiful/pretty girls'. Knowing that these songs could never be about you. The emphasis on looks,False
1107,Yeah that kills me too. Its like every other song out there is about how beautiful a girl is. Annoys the shit outta me.,False
1108,Updoot for ban :),False
1110,Such a dick Spez,False
1111,Can't wait for reddit to implode when Trump is re-elected,False
1112,Reddits over populated with snowflakes and statists. If the Corona virus doesnt kill them off,False
1113,Bat shit virus only kills boomers,False
1115,Trump 2020,False
1116,Okay I get that Trump over Clinton,False
1117,Yes. Every single one of us shares the exact same opinion. After all,False
1118,no,False
1119,It's not about Trump.,False
1120,lol you have to be delusional to still be supporting zion don at this point,False
1121,Generally wouldn't like him in normal times,False
1122,Trump is the only person who shares same opinions as all of us.,False
1128,I think the one who had sex with the femcel is the normie friend.,False
1129,He's not a Chad. He's a normie with HUGE ego,False
1130,"For some guys """"a hole is a hole"""" and that's what they're desperate for. The girls' feelings or looks aren't important to them.""",False
1131,My country is very open about sex. This normie basketball player was just desperate...,False
1133,I swear men can be heartless *obligatory not all. But I would overhear some guys being like damn shes ugly but we banged. Cant be seen with her. Ehhh .,True
1134,Wow. To be honest,False
1135,Its always dangerous to trust a man as an ugly girl. 9 times out of 10 theyre just trying to humiliate you. So sad and what a horrible boy,False
1137,Males do this shit all the time and then brag to each other about it. Just read the normie male subs on here,False
1139,That's what they do. Use ugly girls and leave.,False
1140,Snapchat promoting sexual harrassment as pranks on their front page,False
1141,2 different receptions- they wanted to see their reactions (people enjoying it and people wanting them to move),False
1142,This site and ''company'' need to be blown up and the survivors need to be shot and killed.,False
1143,I wanted to post my post on foreskin restoration/dekeratinization. But the feminist mods of r/sex told me literally no one cares what an MRA intactivist thinks. Really? Im not so sure.,False
1146,If no one cared they wouldn't need to censor you.,False
1147,That aren't feminists they're simply sexists,False
1148,What's the difference?,False
1149,Genital mutilation is disgusting. Let the male decide later on in life if he wanted it or not. I was never cut as a child and I am glad because I got to experience it and know that it's not for me,False
1150,Sex was the first sub to ban me. You never see it on the front page,False
1151,This is what equality looks like.,False
1152,Go post about reconstructive surgery for FGM victims and watch the hypocritical upvotes pour in.,False
1153,Cunts. If it was female genital mutilation wed have a task force lol,True
1154,I'm permanently banned from there for pointing out some sexual double standards,False
1155,Disgusting. Post your post here!,False
1156,Johnny Depp makes surprise appearance at London's High Court as he sues The Sun over column branding him a 'wife-beater',False
1158,god i hope johnny depp does to the sun what hulk hogan did to gawker,False
1159,Good fuck the s*n,False
1161,The judge's first question: mr Depp,False
1162,"Somehow I read this as """"have you stopped beating **my** wife yet""""""",False
1165,I've always hated newspapers (apart from the crosswords) and their websites. Always either spreading false shit or stupid shit that no one gives a rats ass about.,False
1166,Hahahahaha! Good on him!,False
1167,Hell yeah. Atta boy Johnny,False
1168,#BelieveMen,False
1169,Good for him. (Not sarcasm),False
1170,Look at how badass Depp looks on the photo on the left,False
1171,[No Spoilers] Why even call it Season 6?Just bitching about the ridiculous break time just like last year. In reality,False
1172,Its really annoying and confusing. I watch with my dad at irregular intervals (whenever Im home from school) and its hard remembering if weve seen 5a or 5b or whatever. 10 episodes is plenty for a season,False
1174,Try downloading TvShowTime bro,False
1175,Honestly,False
1177,They started doing that in season 4 the same time people started noticing the writing being....Ill be nice and just say off. Maybe its related?,False
1178,Totally agreed. Season 5 to 4b,False
1179,Probably had 6 season contracts with some cast members who didn't want to renew. Five to seven seasons is often the length of TV contracts for lead actors.,False
1180,So I am watching season 4 part 2,False
1181,Yeah the filming was done in August 2018,False
1182,Filming for 6b was done in November 2018,False
1184,(8,False
1185,Westworld would like a word,False
1186,"Being a femcel is about completely suppressing your interest in anyone because you know no one will ever like you backsaw a post that said """"being a femcel is about having 5 crushes at once because no one will like you back""""",False
1188,Yep and then it turns you into a mentalcel too because even if a man genuinely was interested in you,False
1191,"I've embarrassed myself so much by flirting with and asking out guys. I have to mentally restrain myself from flirting. I try to avoid high alcohol environments because of it...I tend to scan the room and go for the guys who are hanging out alone and/or seem the """"easiest",False
1192,Yeah. I told myself to just dont talk to guys unless its a work or professional thing. In the past,False
1193,ME,False
1194,Ive been through the stage of trying to not like/crush on any guys cause I know they would never reciprocate,False
1195,You could honestly find a LVM who just wants any warm body to fuck,False
1196,what's a lvm sorry,False
1197,A lowly male.,False
1198,r/ART TeeHee~!,False
1200,What more can you expect from coombrains?,False
1201,RiP iNbOx huehuehuuehe!!,False
1203,Solution: team up with a Stacy and make her pose with your art then auction it.,True
1204,based and pinkpilled,False
1205,Beauty that Stacy is born with will always be seen as a higher achievement than a talent a femcel  has honed and nurtured for years. Suifuel indeed :(,True
1206,I don't think so?,False
1208,I never understood this part of male psychology,True
1209,this. it's so weird tbh.,False
1210,"[Twitter] Sophia Narwitz: """"You all have seen my feed lately",False
1215,ONE NAME. Should be a T-shirt at E3.,False
1216,I think it's funny that they can't even lie.  Not only can they not name a conservative,False
1217,Yah. They can't even point to some RINO/cuckservative (or whatever you call them) guy.,False
1218,"I was expecting it! I was expecting them to point to a Bernie bro who doesn't think the 2nd Amendment should be *entirely* repealed and say """"See? We have conservatives!""""""",False
1219,I'm sure the people that will try to destroy your life if you have a picture taken with a Republican would be more than happy to hire a Republican.,False
1220,This is both pathetic and hilarious.,False
1221,I see someone offered Jason Schreier as a Trump supporter. I don't know him from Adam. True or fake news?,False
1222,Fake.,False
1225,Florida woman 'killed her boyfriend by zipping him inside a suitcase'- said it was a game of hide-and-seek gone wrong- charged with 2nd degree murder,False
1226,What a horrible way to go,False
1229,Looking at him and his past violence,False
1230,Guy sounds like a piece of shit anyway,False
1231,regardless of what any of you guys think murder is murder as she earned her place in prison. no one deserves to die like that,False
1232,How can a man not escape a suit case? It's literally sewn together with thread,False
1234,It's sad that a woman being appropriately charged for her crimes is considered PPD.,False
1235,Looking at their faces,False
1236,yeah. and since there's a lack of evidence or reliable witnesses it wouldnt be out of the ordinary that this was just as much his idea as it was hers,False
1237,The Crazy Bitch and Bad Boy combination never ends well.,True
1238,Open and shut case!,False
1239,Jesus,False
1240,I need this to happenThat boy Boruto powered up by Karma with Jougan active to see the weak spot in the enemy,False
1241,As soon as borutos jougan becomes a normal thing he needs to learn chidori I think that fits him better than rasengan tbh,False
1242,Theoretically,False
1243,It should since it spots weak points,False
1244,I'm referring to Chidori's speed and the poor reaction time that a non-Sharingan user would have,False
1246,I do not see how the chidori would fit him better then his family jutsu... just because he has lightning release and it's Sasuke's student?,False
1247,That's more than enough reason to at least learn it,False
1248, would already be better,False
1249,I would also love if we get a new jutsu using the jougan,False
1251,He already learnt the basics basics with Hinata,False
1253,Kaguya already did it.,False
1255,I hate being a wagieBeing a wagie is complete suifuel. I just can't take it anymore. I have to clock in in an hour and I'm probably just going to quit my job. I just can't fucking take it. This would be the third job that I have quit. I swear to God being a wagie makes me suicidal. Every day while at work I always fantasize about taking a shotgun and just blowing my brains out. I'm seriously thinking about NEETmaxxing. Idc if people see NEETs as losers,False
1256,Normies can do it because they know when they get home someone who loves them is waiting,False
1257,Most normies don't find love. Sure,False
1260,They're doing chores like everyone else,False
1261,If you become a live in nanny you'll basically be just chilling in someone elses home and making money,False
1262,"Being a nanny isn't """"chilling""""",False
1263,Kids are hard work,False
1266,Save your money,False
1267,Learn Spanish. Your local court house pays $40 an hour for translators. Or you know,False
1268,Maybe respite work would be a better fit.  You get paid to do those things you did as a kid,False
1269,One for r/NEET,False
1270,[News] Ex-Gawker editor sues Daily Beast over story portraying her as racist,False
1273,While I feel for her because her comments were out of context.... It's a fucking Gwaker editor who makes a living taking things out of context.,False
1274,4,False
1275,This will be interesting to keep tabs on.,False
1276,"Burglar complains about being scammed; film at 11.""""""",False
1278,Yes good let the hate flow through you,False
1279,Oh man.... can you imagine if she lost because she was found to a bit racist and homophobic? I Know her comments were taken out of context but holy shit would that sting.,False
1280,Who the hell names their kid Pilot?,False
1281,Oh so now they think being called racist is libellous?,False
1282,I will both presume,False
1286,Besides lifting what would you say was the major change from your old BP beta self?,False
1290,How did he pay?,False
1291,Bank transfer,False
1292,His recourse is limited to the legal system,False
1293,Ugh! Well if it was a bank transfer he must have the receivers name and bank info. Call the bank immediately and have them investigate. Lesson learned u cant trust anyone or anything unless its from a reputable company.,False
1294,drink water carefully lest your uterus be obliterated,False
1296,This is gold xD,False
1297,Like,False
1298,I think the logic is that you take smaller sips from a glass!?,False
1299,and how the fuck sitting down supposed to help if youre not sitting like a question mark?,False
1300,Anytime someone uses the word 'females' instead of women (unless it's like a in scientific context) it makes me cringe,False
1301,It looks like it's supposed to be in a scientific context as she states she has a bachelor's in medicine and a bachelor's in surgery,False
1302,Yeah I suppose so. I should've put that it's only not cringy when reffering to animal species. Can't really recall the last time I read an article where they refer to women as 'females'.,False
1303,Im a little worried now. I drink a lot of water from a bottle. Whilst sitting. Will half my uterus be obliterated? Now I think about it,False
1304,what in the cinnamon toast fuck is this,False
1305,"This is some next level """"if women ride this newfangled train invention their wombs will explode"""" shit.""",False
1306,I'm not sure if I'm more concerned by the fact that this is being said by a woman or that she apparently has a medical and surgical degree,False
1307,???????????????????????,False
1308,Oh dear. That bottle of water I drank is going to sploosh straight through my empty innards with the force of a fire hose and knock my uterus out of place. Oh no.,False
1309,Monday Discussion Thread - Contests/Competitions - (January 27,False
1310,Really,False
