,message,isMisogynistic
427,They like the concept of a woman. They like to take that concept and reduce it to an object. Women having thoughts and feelings and basically not being cooking,False
428,Because they can't comprehend people being appalled at their shit and calling them out on it without some ulterior motive.,False
429,According to them we are all desperate incels in denial hoping posting here will get us a crumb of sex. This is basically cult brainwashing 101,False
430,Wow they really got us! Anyway,False
431,"Because they think of sex as a reward or transaction that """"cucks"""" get for doing nice things.""",False
432,From a post on r/justneckbeardthings. Guy is triggered by leggings that look like hair,False
433,These guys just *love* telling women what women want,False
434,How else are we supposed to know.,False
435,Wtf are you talking about I had an Italian boyfriend with tons of chest hair and he was hot af. Cant go wrong with a happy trail either or leg hair or forearm hair. Without pubes I feel like like Im cradle robbing. Im not a beard kinda gal but stubble is really nice (believe me,False
436,Same! My boyfriend is European and has thick,False
437,Plenty of women like or at least don't mind hairy men.,False
439,(15,False
440,Thoughts and prayers to all the innocent,False
441,Pfft,False
442,And there are lots of furries.,False
443,Luckily for my future bf I can't seam to grow hair on my legs. He will have to deal with a light mustache tough,False
446,Their own mom I mean.,False
447,Have seen a few of them talk about their mothers in very disturbing ways,False
448,I gotta admit tho itd be a total mindfuck to shave legs and then wear hairy leggings!,False
449," 7)""",False
452,That age gap is insane?! A 13 year girl and 25 year old man! I think anyone would be shocked.,False
453,I would act like those guys if it was a 13y/o boy talking about dating a 25y/o woman. It's not men being aware of the danger - it's common sense.,False
454,I don't think it has anything to do with men knowing men are bad,False
455,Also,False
456,We don't have high standards bro,False
457,what is a numale?,False
458,According to Incel Jargon,False
459,"Their definition is already flawed since most dudes who """"defend women"""" online are doing it because they geniunely believe in what they are saying and not cause they want to feel validated only. The validation is still there but there's a difference between that and not believing what you're saying and saying it just to feel accepted.""",False
460,I agree. I just got the definition from Incel Terminology and put it in my own words.,False
461,It's so sad that in my country,False
463,Lol I phrased wrong then. I meant that in my country,False
464,In what country are you living? Seems kinda unusual tbh,False
465,I'm Mexican,False
466,Lucky guy,False
467,She is just a beautiful lady! This is why incels are despised,False
468,Hmm... This short guy (who definitely can't get a girlfriend because he's short btw) sure looks happy considering he's dating a gross ogre.,False
469,Lol they call 'ogre' to this beautiful woman but they are the ones 'discriminated for their looks'?,False
470,Beautiful happy couples that disprove their ridiculous theories,False
471,She's hot idk what their talking about?,False
472,That is indeed a genuinely cute couple!,False
473,Man they look great together. It only proves that they are hypocrites. What is wrong with this couple.,False
474,"Get this post out of here because it jeopardizes my whole narrative of women being shallow and obsessed with a guy's height""""""",False
475,Elliot Rodger Documentary (Part 1) - Misfit Mass Murderer Turned Saint,False
476,The incel truth can fuck you up,False
477,Its not a truth.,False
478,watch Mumkey jones' videos about him.,False
479,Oh man,False
480,All women are superheroes,False
481,Casey Anthony?,False
482,Bill Clintons victims?,False
483,If all women are superheroes,False
484,Omega alpha smack down super women,False
485,There's probably a character in a Japanese anime with that name.,False
486,Emphasis on the women.,False
487,Apparently hormones are an important factor in one's software development skills,False
488,(20,False
490,Oh yeah I always take my male hormone dose before going to work or I would just sit there with no clue about code and the unfightable urge to bring everyone coffee.,False
492,I always knew when our female coworker forgot her hormones. She would start making everyone sandwiches for lunch!,False
494,But not as good,False
497,They're so advanced yet so ass backwards in some ways.,False
498,Yeah but there's a threshold beyond which the code region of your brain gets super activated. That's why only a few super manly women can code,False
499,Im so glad you blocked him out in pink,False
500,Haha I thought of that too. As I was blocking out the first couple of names I just picked the first few colors in the palette and towards the end I was running out of colors so I picked that one on purpose :D,False
502,Femoid emoji,False
503,wear did i hear that one before ???????  he tells me then she has a BF but things are not going well between them,False
504,They all read from the same playbook,False
506,Well when things arent going well in your relationship cheating on your partner usually helps.,False
507,https://preview.redd.it/wy85cuoe2lbz.jpg?width=216&crop=smart&auto=webp&s=0b46097ad75ab7ca4314a791b1ec2029513bf046,False
508,Do not speak to women above 25.,False
509,Lmao,False
510,Sometimes in the business world you have to ask a woman over 25 where the guy that actually does stuff is.,True
511,You were her emotional tampon the moment she realized she can't fuck you,False
512,TBH its nice playing blue pill with these women sometimes. She even paid for my meal and a train ticket.,True
513,That was because she couldn't get you and realized that you valued your time over her. Once she felt that you would keep stepping without her,False
514,(21,False
515,Thot dissposal services inc.,True
516,...and would be an absolute drama fest to travel with. Travel solo...experience freedom.,False
517,What does the 100 (1000?) cock stare look like? I'm sure I've *seen* it,False
518,Woman Who Falsely Accused Teenager Of Rape Will Spend Just One Night In Jail,False
519,Sick!,False
520,Welcome to Clown World. Honk honk!,False
521,This is like so equal huh? Equality yay!,False
522,Whos doing this shit,False
523,May as well just put her in time out and make her think about what she did.,False
524,**[Here is a subreddit that provides support for victims of false accusations](https://www.reddit.com/r/SupportForTheAccused)**,False
525,The day we stop having White Knights as judges is the day women will be served equal justice as men.,False
526,the liberated woman,True
528,This is a result of a lack of abstract thought to the extent that you cant conceive of the greater workings of the world and how small actions impact the foundations of our world. This is particularly why you arent likely to see a female philosopher or physicist.,False
532,Every time the interact with someone they have twenty voices in their heads telling them were wrong or should be angry,False
534,Basically just confirms what i commented earlier today,False
537," 5)""",True
538,(23,False
539,This is brilliant,False
540,Society: The past is the past! just man up and settle down with her!,False
541,Society as in men. Men were the ones who empowered women and men are the ones who can take away their empowerment with the snap of our fingers. If men took womens rights away they wouldnt take up arms and fight,False
544,The divorce between Responsibility & power is a fundamental problem. So we complain about  women,False
545,All uteruses are equal. All.,False
546,(24,False
547,And rarely TWO calves.,False
548,I dissected a pig uterus with a fetal pig inside. It was really sad but it was also really interesting. It was cool to learn what a uterus looks like (although Im sure a pig uterus looks a little different than a humans). But when I picked up the fetus I guess my motherly instincts kicked in and I didnt want to set it down. I was close to crying when the teacher pried it out of my hands. I wouldnt do it again,False
549,... fucking hell. I'm glad I didnt see that. The pig fetus would be enough to upset me,False
550,when i was in 10th grade biology class some of the boys ate a little bit of the frog's tongue.,False
551,ew,False
552,i did try to warn them that it was full of chemicals to preserve the frog. even so,False
553,Similar story,False
555,Its cool to see how things like that function,False
556,Oh my god its pig dick patrick,False
558,And does he think the uterus is always the size it is when its holding a fetus?,False
559,Yeah mine is,False
560,But what about drinks? You gotta have drinks with chips.,False
561,Oh btw this man wants to be a doctor.,False
562,Oh no,False
563,Perhaps he should go into politics instead.,False
564,Hopefully not a gynecologist.,False
565,"[Gaming] Matt Kim / IGN - """"Epic Games Boss Says All Politics Should Be Removed From Games""""""",False
567,This is why I dropped out of covering games and dropped out of reading gaming websites altogether. These sites are clickbait factories with an agenda that is completely divorced from reality. I didnt have the time or energy to be part of it.,False
568,If Kotaku and Polygon could... Clinton someone out of the industry I think this is what would finally push them to do it.,False
570,Epic games CEO found dead this morning. Autopsy revealed he slipped on his stairs muffin and fell to his death. His wife,False
571,(25,False
572,Headline and framing might actually be misleading,False
575,Most aren't against political themes in games,False
577,I disagree. If it had been a walking simulator with some noninteractive cutscenes but none of the dialogue was changed,False
581,Paradox games tend to show that investing in your economy and conquering your neighbors is the path to prosperity,False
584,Im honestly fine with any topic in games as long as the writing is good (of the game has a story beyond something like Mario),False
585,Why Did Funimation Drop Interspecies Reviewers?,False
586,(26,False
587,Because they hate interracial/species sex,False
588,It appeals to straight males,False
589,I am a wamen and I wanna see this show badly oof,False
590,You can easily pirate it,False
591,I know I absolutely hate Funanimation for how they rewrite animes so I would never imagine watching it legit,False
592,Eliminating oppressor appeal supersedes appealing to protected classes,False
593,No *true* woman likes such sexist filth /s,False
594,The Judas release is the way to go,False
595,BECAUSE IT WAS PORN,False
596,except that its really not. just skimmed through an episode to make sure and yep. no porn. Lots of covered up bits and glowy light covered bits,False
597,One JP friend said it was actual hentai. ~~Any censoring was done by Funimation.~~ Apparently there are two versions. Guess I know what to think of my friend.,False
598,There is a censored version of it but even the uncensored version is only on the level of high school dxd or Valcerie drive mermaid or to love ru and I for one consider ishuzoku less lewd than the others because it has more humor to offer giving more reasons to watch than just the oppai,False
599,I know I should understand this comment to be in this thread,False
600,Git weeb.,False
601,so its airing uncensored on  BS11,False
602,I don't know how you can make a censored version of something that's somehow less explicit than the uncensored version,False
603,Have you watched the later episodes lol? It turns into soft-core hentai in some scenes and the people making the anime have admitted that it'll get even more rauchy down the line.,False
604,watched the gender swap episode. i think it was the 3rd. it was definitely tamer than i was led to believe.,False
605,Feminist pornstar Adriana Chechik: It's okay for women to pee/squirt on public escalators because men are allowed to show their nipples in public,False
606,sToP oBjEcTiFyInG wOmEn,True
607,it's why it's called feminism afterall and not egalitarianism or humanism or sth,True
608,They *do* want equality. They just want to be more equal than men.,True
609,r/trashy,False
610,What is with the false equivalence? Those two things arent remotely the same.,False
611,r/imatotalpieceofshit,False
612,r/iamatotalpieceofshit,False
613,r/iamatomatoonastick,False
614,r/subsifellfor,False
615,This is as scummy as it gets,False
616,Yea its disturbing how gross it is and its even more disturbing the amount of disgusting people that came to her defence.,False
617,Just kill all the pornographers - problem solved.,False
618,I mean,False
619,(27,False
620,Peeing on the escalator or anywhere in public is bad enough,False
621,Male feminist reacts to vile scumbag who murdered his kids by telling ALL men to,False
622,He's a public figure who pops up on TV and has written for a shitload of mags,False
623,I already didn't kill women and children thanks,False
624,"Isn't there a white knight upon a fiery steed?""""""",False
625,Holding out for a hero,False
626,Im holding up for a here 'til the end of the night,False
627,Oh shit,False
629,I dont recall any man I know killing women,False
630,3,False
631,By his own logic he should also stop killing women and children,False
632,It's hilarious,False
633,I don't understand why you'd want to harm your own wife. That's *your* wife,True
634,Andrew likes killing men but hasn't realized that he could stop killing all people regardless of age or sex.,False
635,Is he also blaming himself as he is a man himself or does he not consider himself a man thus having an existential crisis?,False
636,She expects me to buy photos from her,False
637,Dumb hoe,True
638,Send me 5$ and I'll send you something even better,False
639,Send a request for $555 and she might click accept thinking you sent $555 by mistake.,True
640,Google tanzania nude and it's free. I find it funny,False
641,Ewww. If you value your eyes,False
642,Probably should have mentioned that part,False
644,Pretty much,False
645,Choosingbeggars,False
646,She'll be posting her side of this on r/choosingbeggars.,False
647,Gotta be shit at your job if you need to beg for clients on dating sites. I wouldn't trust a plumber that signed up to Tinder to get jobs.,False
648,Lol so ugly,False
649,I would pay that creature to put more clothes on.,False
651,Uninhibited,False
653,"When I asked """"how stupid can you get?"""" it was a rhetorical question",False
654,Making this my new AIM status.,False
655,This feels like a one sentence horror story.,False
656,And the laughs keep on coming.,False
657,It's the one STD that improves your health.,False
658,Get what removed exactly?,False
659,The magical vaccination cum,False
660,I'll get the shopvac,False
661,Yes. It does. Please take her to the hospital and explain this to your docs. Also please record it and post it for the rest of us to enjoy.,False
662,Vaccination by cum,False
663,And yet again,False
664,Surely this is a troll....I hope,False
665,If this was true imagine how easy it would to be spread new vaccines around,False
666,Didn't work like she thought,False
667,MD??? Clown world!!! Honk Honk,False
668,Probably a psychiatrist.... complaints from crazy patients wont be taken seriously right?,False
669,Dummy,False
670,everyone loves titts,False
671,He's a little confused,False
672,And vaginas are just baby dispensers. Anyone who finds vaginas sexual needs help. /s,False
673,Yeah dude. Totally sick. /s,False
674,Obviously she's never watched a woman masturbate,False
675,So like,False
677,What's her take on buttholes?,False
679,So why do women cover them up if theyre not sexual organs??,True
681,I started to read,False
682,He wants to talk to more girls but wants to do it in a way that he wouldn't judge someone else for doing. Meaning he finds it very hard to cold approach.,False
683,It's not that he cares if other people judge him,False
684,Saw this being taught to a medical friend of mine in a course In the UK,False
685,Is the single most quoted reason for becoming homeless so they are admitting men get abused?,False
686,Nah,False
687,Ah ok,False
689,It shows how many men do commit suicide if the murder rate is approx 3+times more for women.,False
690,Forced Marriage Unit?,False
691,They investigate reports of forced marriages.  Fruits of multiculturalism.,False
692,Since most people homeless are men...that should reveal something to people,False
693,Crime survey for England and Wales 2018 had men as 1 in 3 victims of DV,False
694,Source?,False
695,https://fullfact.org/crime/are-third-domestic-abuse-victims-men/,False
697,Google it,False
699,I did Google it. No results from reputable medical sources.,False
700,The only results from good journals I could find were just calling out the authors.,False
701,Those are the best kind of results,False
702,Googled it,False
703,I call it BS sindrome,False
704,I searched for it (both written out and the acronym) on multiple search engines including ones which specifically search for papers. All I have found is people making the claim that this exists,False
705,From this thread: https://www.reddit.com/r/funny/comments/f86kpq/dayum/?utm_source=share&utm_medium=ios_app&utm_name=iossmf,False
708,Explain Ellen and Portia to me then,False
709,This has got to be a joke. Bindel and Raymond are the names of famous lesbian feminists,False
710,I assume it's referring to Gertrude.,False
711,This is just the herp derp lesbians b ugly joke all over again. Which never made any sense to me given that lesbian is like,False
712,Brilliant takedown of a carousel-riding freeloader (found on MurderedByWords),True
714,would love to see her face,False
715,[Ask and you shall receive](https://i.redd.it/2g3otgoh20h41.jpg),False
716,Is not even a memorable face,False
717,God damn,False
718,90 day ban for telling the truth.,False
719,Of course you get banned for an actual roast.,False
721,[https://www.reddit.com/r/RoastMe/comments/f3m3ah/im\_23\_working\_a\_deadend\_job\_for\_less\_than\_living/](https://www.reddit.com/r/RoastMe/comments/f3m3ah/im_23_working_a_deadend_job_for_less_than_living/) here is the link to the post.,False
722,THOT slayed!,True
723,This made my day.,False
724,This post may have given her a single moment of clarity,False
725,Christ...that was a good read and not one point can I disagree with. This man understands the female mind.,False
726,Is Shelia Szas a nympho??,True
727,Goddamn it! Get the hell out of this sub!,False
728,This is bullshit,False
729,I gave my word to Shiela. I'll never tell.,False
730,You will when I depose you,False
731,You cant do that!,False
732,You know what?! Maybe he cant,False
733,Goddamn it. Are you really gonna commit perjury?,False
734,No. It's just a fetish.,False
735,Anyone else have an overall feeling of nostalgia when hearing 505? This is one of the few songs that genuinely make me feel a type of way. My heart clenches a little no matter how many times Ive heard it,False
736,I'm going back to,False
737,Think this is the source of the nostalgia feeling? I never really considered that this song was meant to invoke a feeling. Even when I was 14 y/o and never had even been in a relationship,False
738,Stop and wait a sec,False
739,Wow! I love that idea,False
742,I like 505 but I do not personally understand why its regarded as holy scripture around this forum. I think its a good song,False
743,god it makes me feel like i miss an ex that i never even had. i feel ya,False
744,I feel this way about a lot of songs and I always thought it was strange because nobody had ever talked about it. 505 is definitely one of the ones that makes me feel this way,False
745,This song makes my heart lurch...and it also  makes me want to jump around. Good shit.,False
746,(10,False
747,I love the 2009 version. It's darker,False
748,Agreed,False
749,505 is really something special in a way that i can't even explain. The first time i listened that song i cried. Like I FUCKING CRIED out of nowhere. There are no song now that makes you feel like it.,False
750,[SocJus] Apparently,False
752,This does not sound too bad. What the worse that can happen with announcing sports?,False
753,You mean other than the on screen shot choices potentially being a lot of lingering ass shots and not following the action?,True
754,I dont think you watch sports. Because they never on the announcers that much during the game.,False
755,I mean worst that could happen if it's an all female broadcast team including those calling which shots to use lol,False
756,True it just you ass shot thing is not a possibility,False
758,Could be worse,False
759,CBC's been pushing this narrative this year up north too. Granted,True
760,I can call him an old fossil and still say he shouldnt have been fired for those remarks.,False
761,I was on the fence,False
763,Luckily I have NHL.tv so I can just get the Philadelphia feed of Flyers Games and listen to Jim Jackson whose been calling Flyers games since 93 and Keith Jones who played for the Flyers.,False
767,Yepp,False
772,Are you literally shaking? (As you pull another dupe that you will grind into materials),False
773,t-3 days till I deal with crippling depression over my ability to roll nothing but absolute garbage and the massive desire to bankrupt myself for near worthless pixels.,False
774,Dont you deal with this shit enough? Why do you have to write more of it in your free time?,False
776,STUNNING AND BRAVE,False
777,If only more shitposts put forth this kind of effort.,False
780,You just want people to play your made games,False
782,I cant wait to play 50 Spider-Man levels,False
783,I know how to solve many Physics problems,False
784,So how can we help? Can you provide examples of questions you can answer mathematically,False
786,I'm not a physicist but I am a engineering student who completed the physics classes.  What has helped me gain an intuition solving problems is trying to tell a story with the equations.  Also I think about things that happen in everyday situations and try to apply physics to them and think how they apply to the equations.  Hope that helps.,False
788,Keep practicing.,False
791,What is the point of pretending like you really dont know youre pretty when you get asked out every day and get laid or hookup almost every day/week?Every Stacy I knew had this experience when I was in hs. Im also sick of Beckies and Stacies being allowed in here and on the ask subreddit. Do we really need their humble bragging experiences of being asked out every day and having guys beg to sleep with them?,True
794,I think Stacy's assume all girls experience life like them.,True
795,That's a mighty heavy assumption...,False
796,go away,False
797,go away lmao. why are you here? what is your purpose here?,False
798,To support women.,False
799,,False
801,I'm so tired of beckies and stacies being allowed here. What's the point of them being in a space that has little correlation to them? Maybe it's just me but I actually get upset when I see a Stacy or Becky posting here lmao,True
808,seriously. ive seen some stacies say that they used to be a femcel but glowed up,True
811,Agree,False
812,24-02-2020,True
815,r/mentoscells,False
817,There are literally browser plugins that can do this for you.,False
818,Hi,False
820,Hey,False
821,OMG Some are so distasteful that I don't even want to genderswap them ... I don't even want to say this as exopsing satire ... yikes...,True
822,Haha same ,False
823,(16,False
824,The subreddit wasn't created by me,False
825,FDS has more red flags than a communist revolution. There isn't anything there that ISN'T toxic.,False
826,Yeah,False
827,I love how toxic they are,True
828,10 out of 10,False
831,Is there a non toxic side?,False
832,Woman Steals 1.2 Million Over 16 Years - No Jail Time - Pass Granted,False
833,Entitled much?,False
834,Cunt,True
836,That's also prime age for divorce rape,True
838,Just spawn a child bro and marry a gambling druggie addict .. if you have a child who cant be taken care of by anyone else you can commit any crime in the UK,False
839,Excuse me,False
840,This is not violent,False
841,Probably only true for woman if a single father would do that the kid would be taken away immediately and to jail he goes.,False
842,Vagina.,False
843,She's a criminal,False
844,Women can steal money and play real life GTA and get no jail time. Wonder what thats like.,True
845,Surely most of his responsibility went to some man or was countered by some gynocentric institution.,False
846,I'm not saying it didn't happen,False
847,Creepy Instagram Model SENDS NUDES To 13 Year Old Boy (NOT Arrested)-Isaac Butterfield,False
848,Sick and tired of the double standards in the justice system.,False
849,Thats because its not a justice system. Its now a legal system full of bias. No justice has happened in there in a loooong time,False
850,It's a social justice system.,False
852,What the actual fuck?,False
853,Isaac Butterfield is a legend. Feminists hate him as he's constantly calling them out on their bullshit.,False
854,(18,True
855,Male privilege is taking quite the beating this month.,False
856,A week after this was originally reported various media have played it up again in ways that are promotional for her. She will actually make money out of it. She wouldn't be the first woman to act in perverted ways towards boys and subsequently profit. It's been quite lucrative for some.,True
857,Whats her name,False
858,OP posted a picture about loving dr. Pepper. Later in the tread he (purple) was confused he knew more about vaginas than the women did.,False
859,(19,False
860,Supposedly the pineapple thing is correct though. Idk about the dr pepper. Diet does affect how you taste and smell,False
862,Fruits and vegetables make things taste better. It's why people tend to prefer eating animals like cows,False
