,message,isMisogynistic
1723,I looked at her Twitter... she has a livestream,False
1724,She wants a job at the Young Turks SO BAD she can almost taste the professionally-applied lipstick.,False
1725,I used to follow every feminist i was recommended to until they eventually say something lookist or fatphobic. I'm still a feminist but i one must be careful and edit on who we follow bc some of these women are still shedding toxicity while having a large following of fiery young ladies who think replying with an avatar of someone unattractive that they disagree with is an how they get points in an argument.,False
1728,This is what awaits a pickmeisha,True
1729,What would happen if they switched roles and a man came up to a woman in that matter ?,False
1730,Props to the guy for being so calm. Some people really need to get off the drugs and do something better with their lives.,False
1731,"It may have been schizophrenia because she was so paranoid about what people were """"saying"""" like she thought people were following her and stuff""",False
1732,Wait this subreddit is posting about a schizophrenic woman as if she has some sort of privilege?,False
1735,If it was a guy that would have proceeded very differently. Fits the theme of the subreddit. No reason for hostilities.,False
1736,You havent seen people be annoyed by an insane man before? We live different lives I guess. I see people talking to birds and ghosts every day. Mostly people just pretend they dont see them or take it in stride. It seems a stretch to try and make this anthill into a mountain IMO,False
1737,Im am very well! How about you? How shitty your life is,False
1738,Im having a fun time laughing at some of these subreddit communities.  Its childish but fun.,False
1739,Good for you,False
1740,You know that lady is probably mentally diseased right?,False
1742,You have issues man.,False
1744,(17,False
1745,You cant. The only way to keep the WiFi from sending a signal is to reset and do not accept the terms and conditions. If you do that,False
1746,Fun fact: you can connect to the open network and I switch off speakers without requiring authentication,False
1747,most feminism isnt pro women. its just anti men,True
1748,JUS FAX,False
1750,Oh but how would they prove that they support women if they dont piss on men....,False
1751,Feminists can fuck off.,True
1753,Listen to their actions and the context,False
1755,Thanks mark,False
1756,But that's exactly how it is interpreted to be celebrated by feminists. Radical feminists would like to see this every day,False
1757,And you're posting yet another anti-feminism post on a Men's Rights forum. Is this irony?,False
1759,How is this anti-feminist? Could you explain?,False
1761,Celebrating women's day. *Immediately mentions men.*,False
1762,Imagine if this was a man,False
1765,fucking weebs,False
1766,This sums this up perfectly,False
1767,Happens more with men,False
1768,True. There are entire communities that idolize criminals,False
1769,What freaks me out are the communities on Tumblr that worship the Columbine school shooters and fantasize about being in relationships with them. Talk about skeezy,False
1770,Male killers get fan mail by the pound. I think this is just a thing where if hundreds of millions of people hear a story,False
1772,That wasnt a percent,False
1773,Not really r/pussypass there are a lot of people who believe that the school shooters are hot and a lot believe that ted Bundy shouldnt be in jail and fantasize about him. There was even some people who blamed the girl who got away from him and hate her. Human race is a fucked up species,False
1774,Yeah more /r/cringe,False
1775,Look,False
1776,Male school shooters have entire fan bases Brody,False
1777,Anyone here like Dakota R/T's? Pretty sure mine is the cleanest,False
1778,I had the regular cab version of yours. I loved mine but sold it last year finally after 8 years of owning it.,False
1779,Ask the Pros: Worst Roster Change | Six Invitational 2020 | SiegeGG,False
1780,The Gotcha move is and was the worst for sure. O and Liquid with -bullet +gohan,False
1781,Nope the -pino +gohan was the worst,False
1782,O yea,False
1783,It wasn't,False
1784,Pino never really put up bad numbers though,False
1785,But it didn't even affect them. They still came out number 1.,False
1786,#NAME?,False
1787,Crazy how different R6 esports would be if the rumored -Laxing +Bosco had actually happened,False
1788,- NR losing Wokka and Ramu was the worst IMO. (I know they were separate). NR have some insane players but they just havent looked the same since.,False
1790,Surprised no one said Canadian leaving eg for eg really seemed like the start of egs down fall.,False
1791,-Goga +Cryn was criticized from day 1 and in hindsight that criticism was correct.,False
1792,From recent changes I'd say -Geo +Gotcha and -Goga +Cryn were quite bad,False
1793,goga had shit aim at his last days. Yes he si si plants but atleast have some aim.,False
1795,www.makeplayingcards.com,False
1796,I've used these guys a few times from the UK. Never been disappointed.,False
1797,Yubb.. I use them for all my printed cards. Only time I've been disappointed is when I ordered a test of plastic cards. And then I was just disappointed on how thin they were. Not their product quality (was checking out if they did a creditcard thickness which they dont).,False
1799,Bakhar Nabieva,False
1800,Hell yes,False
1801,Road rage,False
1803,Thanks you as well and everyone that passed by may it spread to those especially who need well wishes and connection to others and lifted spirits may they persevere find peace joy hope!,False
1805,That is a crime dude....get your shit together,False
1806,Felony in Florida even if you have a permit to carry.,False
1807,No doubt what the hell right?  LOL,False
1808,I used to do that with Bebe guns before camera phones were out! ,False
1809,That sounds incredibly stupid. Only thing worse then pulling a weapon you aren't willing to use is pulling a replica gun or bb gun that others will think is real.,False
1810,And I bet you would be the person who would try to sue the guy who had a carry permit and shot your ass when you pulled it on him.,False
1811,He hit the brakes hard asf,False
1812,Meanwhile,False
1813,Steering with the knee.,False
1814,This seems really fake.,False
1815,Only pussies hide behind guns.,False
1816,When will AppleCard start reporting to credit bureaus?,False
1817,Dec-19,False
1819,They only report to Transunion right now.,False
1820,The search box yearns for attention. Use it.,False
1821,Every time some asks on this sub they move it back 10 months.,False
1822,So the answer is sometime in the 24th century when money has been abolished.,False
1823,They've been reporting it to credit bureaus.,False
1824,They only report to Transuinon. If you have $0 statement balances then dont report anything.,False
1825,A quick blind Weller 107/SR taste,False
1827,SR is so good for the price. If you dont mind me asking,False
1828,Knoxville! Thats the standard price I see around here when its available.,False
1829,Nice! Im glad youre not getting ripped off as much as I am. I live in Atlanta. 107 or 12 year,False
1830,I've seen bottles of the 107 and 12 for $250 and $300,False
1831,I feel your pain brother as im in ATL as well,False
1832,Same in Ohio. $49.99 plus tax ends up being about $54,False
1834,I like some of the things you listed,False
1835,I think they are both great and sr is my normal wheater when I can get it.  107 is better imo but harder to find.,False
1836,I find special reserve to be pretty mediocre and would take ogd114 for a few bucks less. Its good for cocktails but def not neat,False
1837,Agree. Weller sr is borderline undrinkable for me,False
1840,Can .local and .config be public? (GitHub backup)I want to back up my settings to a public git repo. I know where my ssh keys are stored and excluded those. Is there sensitive info in `.config` or `.local` that I should be wary of excluding?,False
1842,Gotcha. Thank you,False
1843,Why don't you backup to a *private* git repo?,False
1844,To share? (Within reason?),False
1845,Isn't it extremely sexist and paranoid to consider all men to be violent towards women and compare them to guns?,False
1846,FemaleDumbShits is such an incel sub man....,False
1847,Femcel you mean,False
1848,No incel isn't a gendered word. You gotta stop letting radicals redefine language to their whims,False
1851,Men dont exist to serve her,False
1852,Okay,False
1853,Dont you have to use the gun to kill or be killed by it?,False
1854,What type of logic is that? Seriously,False
1856,The misandry is real,False
1857,I find that incredibly offensive as a man and a gun owner.  Every single underlying assumption of her statement is completely incorrect.,False
1858,A double whammy of ignorance about both men and guns.,False
1859,[Industry] Star Wars: The Last Jedi Director Rian Johnson Admits He Didnt Care About Star Wars Canon And History,False
1860,I mean I already knew that given that Colin quit over your dumbass movie and JJ spent half of RoS attempting to retcon it out of existence.,False
1862,That was clear with how garbage the movie was.,False
1864,I hated that movie with a passion. I don't know why Rian did that either,False
1865,I think it's because he partially doesn't like Star Wars and because he's never done anything except writing singular movies. As far as I know,False
1867,Simple: Lucas trusted Kathleen Kennedy and it turned out she was just a snake who wanted to use his platform for politics an Disney just went with it,False
1868,It shows,False
1871,Shocking. Mind blowing. Truly.,False
1873,No shit.,False
1874,Abuse is abuse,False
1875,As a feminist I wish more people were speaking about this. Like seriously.,False
1878,I have a similar friend in a similar situation right now. It is tough to watch that's for sure.,False
1881,You cant show someone the pill. They gotta discover it for themselves.,False
1882,Have you considered telling your friend's wife and her friends how you feel about the way she has treated your friend?,False
1884,Keep him busy doing physical shit at least once a day. Seriously,False
1885,Keeping busy is highly underated,False
1886,This is your time to help now. Your friend helped you when you were there and now its your turn. He never had the luxury of learning these theories. You did. The universe has placed this in front of you for you to intervene and make this right for your friend.,False
1887,Most Red Pill suckas in here dont have a spiritual nature to them. Let alone being aware of Jungian psychology and how powerful it is if you ever wanna become an Alpha.,False
1889,Better him than me. You have to let this play out,False
1892,YES,False
1893,Will a USB partition work?Will it be able to work if I divide my usb into two sections and have tails on one half and regular storage in the other?,False
1894,No.  If you want storage on the drive,False
1896,I stand happily corrected. Thanks!,False
1897,No worries.,False
1898,Yes I have done this with mine. I have 3 partitions- one with Tails,False
1899,Always do Tails ***FIRST***,False
1900,Thats the one. I tried it a few ways first but there is indeed a correct order to do it,False
1901,If you don't want Tails to create persistent volume that takes all remaining space first install Tails,False
1902,Florida woman arrested for allegedly leaving boy alone in a filthy home without food,False
1903,Kid went through a hard 9 days. But now will be so much better off. Fuck her. Hope that kids ok.,False
1904,He'll probably end up in foster care. Which can be better,False
1905,I know foster care can be tough but it's better than being literally abandoned.,False
1906,I agree.,False
1907,Hope youre right. This can breed strength but it can also unfortunately set a child up for instability,False
1908,She needs to be put out of her misery...,False
1909,39???,False
1910,Drugs and booze will do that.,False
1911,That's a fucking hard 39 years,False
1913,Meh... She will get a slap on the wrist and will be out in less than a few weeks.,False
1914,She looks like a Michael Jackson on meth,False
1915,I dont think this is a denial of a pussy pass,False
1916,This sub should just be changed to r/whenwomendobadthings,False
1917,Sometimes while reading comments I'll get instant hotdog water vibes that only get worse,False
1918,They cant help it. Its in their nature.,False
1919,Not overlooking the fact that I'm no chad and I met my fiance on Tinder a few years ago.,False
1923,Nice,False
1924,thanks :) any suggestions for future books?,False
1925,Fuck man. This may be a series I gotta watch through,False
1926,Same.,False
1927,Haha,False
1928,Thats a long list but Ill try to watch it when I have time,False
1930,Start at top,False
1931,Ive been dying to read some of these books. Great job,False
1932,If everything goes well you'll just need one,False
1933,nice fam! i would never read the text guides recently anyway. ill be sure to watch the vids once i got time. thankyou,False
1934,For later,False
1935,Thank you for this! I will make sure to check them out,False
1936,You should also have the red queen by Matt Ridley,False
1937,woah,False
1938,Wow.,False
1939,Why cant I download this?,False
1940,Amazing thanks for sharing her video with us,False
1941,Bruh,False
1942,u/vredditdownloader,False
1944,I wish I was that dog lying there on her bed....just think of all that he gets to see,False
1945,"[Tech] Didi Rankovic - """"NYU Law video teaching about copyright was removed by YouTube for copyright infringement""""""",False
1946,(38,False
1947,Fire engine on fire.,False
1948,Do as I say,False
1949,Talk about YouTube proving the profs point.,False
1952,If he used a sample short it could be considered fair use as it is being used as an example of what can be used under copyright,False
1953,Going after lawyers seems like a dumb idea.,False
1954,Especially a law professor from a tier 1 university.,False
1955,Here's a video on the subject by Hoeg Law,False
1956,Computers can't understand fair use.,False
1957,Can't have people being educated on copyright law,False
1958,When do you unlock clans,False
1959,Level 45,False
1960,Woman is a burden... Indian men protesting on womens day...,True
1961,Just the tip of the Iceburg. Men are waking up.,False
1962,Good on these dudes.,False
1963,"Should have had balls to say """"no"""" when their parents were behaving like brokers of women to get them married.""",False
1965,Wow I didn;t know there were real men in India. You go guys,False
1966,Not gonna lie,False
1967,Indian niggas are a fucking blessing bro ,False
1968,Refreshing to see this in the cuck city which is Bangalore ,False
1970,Absolutely based,False
1971,I love this. Keep it up my Indian brothers. I've heard how bad it is over there,False
1973,Who hurt them?,False
1974,The men deserve an award ,False
1976,Thats already possible but requires a license to use HIPs.,False
1977,(41,False
1978,We see the OS used to connect to GP in the logs.,False
1979,Guidance on where in the logs to look? Is this hips data logging??,False
1980,02-03-2020,False
1982,This also becomes easier in PAN-OS 9.1 as Client OS Version is a column in the newly introduced GlobalProtect log.,False
1983,Labour councillor,False
1985,Perfect ranking gotta stay perfect.,False
1986,Precision,False
1987,Unity,False
1988,Perfection,False
1989,Primitive,False
1995,nice,False
1997,TRUE LULW,False
1998,Nice nice.,False
1999,I guess you cant play anymore?,False
2001,(44,False
2004,He thought the threads were there to screw it into the vagina/cervix.,False
2005,(45,False
2006,Ouch. Jesus..,False
2007,I'm pretty sure my whole reproductive system cried when I read it,False
2008,To be fair...it does look like some kind of tampon applicator...I'm still laughing a bit.,False
2011,You didn't know about your geyser?,False
2012,I know Im reading way too deeply into this,False
2013,Eh,False
2014,Plot twist: He used the kitchen tongs transport it!,False
2016,I know what Facebook group this came from. The internet is such a small place. Lol,False
2017,Or.... your username is relevant.... *narrows eyes suspiciously*,False
2018,Roap,False
2019,Timothe Chalamet is not the only cast member in an Oscar-nominated movie this yearVictoire du Bois (Chiara) voices a character in *I Lost My Body*,False
2020,Ill definitely give it a watch soon! I just finished that docu-series Cheer,False
2021,has cmbyn won any awards? it deserves several,False
2022,Best adapted screenplay at the 2018 Oscars,False
2023,Timothe Chalamet won a boatload of critic's awards and the Indie Spirit Award,False
2024,You right. It's a good film,False
2026,M.  no n,False
2027,There are a million different ways to smile. Some of which are much much more attractive than others. Google it.,False
2028,\* Only works if she's attracted to you.,False
2029,What if you hate your smile,False
2030,Want to use this but I feel uncomfortable when doing it to a girl. It seems ungenuine...,False
2031,HIGHLY culture-dependent,False
2033,"Check the """"List View : Allow Folders to be expanded"""" in Preferences""",False
2034,I cant believe I was so stupid to miss this... You made my day,False
2036,Looksmaxxing latelySo,False
2037,(49,True
2040,yess!! it's crazy how people just respect me more in general. like,False
2041,Beauty is power in all kinds of ways,False
2043,Solo travel is booming and the demographic which has experienced the strongest increases is older women/women in mid age I think.,False
2044,As is budget traveling. I have met many middle aged/senior travelers who are experiencing so many new places and doing it on a shoestring budget.,False
2046,(50,False
2047,Yep.. 48 year old (mostly) solo traveler here.  I don't stay at hostels all the time but when I do I'll pick the <6 bed rooms.  I've gotten lucky at a few where I was the only one in the room.,False
2048,Maybe,False
2049,Don't rule out switching hostels. I've done it myself when I didn't like the atmosphere of the one I was in.,False
2051,I find that most people over 40 smell like onions. For this reason,False
2052,If you aren't bound by school schedules,False
2053,I've been solo travelling since 21. I'm in my early 50's and I still stay at hostels because (a) I love the vibe,False
2056,Reporter playing victim card after publicly criticising someone.,False
2057,"Blondie needs to STFU. """"You disrespect women."""" As if she is the representative for all women on Earth.""",True
2059,Honestly people getting mad over dumb shit like they represent every person of their kind... that just aint how it works.,False
2060,White womyn are,False
2061,He just doesn't like her. I hate that mentality,False
2062,(51,True
2063,I hate all the high heel brands can't they make something that appeals to men? How can they stay in business if men don't buy their product?,False
2065,Gave me a good laugh,False
2066,"I have a feeling that she would attempt to justify the fact that Lane Bryan only markets to women.  Go to their website and type in """"men""""",False
2067,Victoria's Secret needs to make and sell jockstraps >!/s!<,False
2068,They would be lacy with cute little flower patterns on them. lol,False
2069,The full clip reveals she talked about how his wife was probably scared of him at home and couldnt speak for herself and that stuff. Hell I wouldnt wanna speak to her either!,False
2071,Its not your posture lmfao,False
2072,?,False
2073,You standing straight up isnt making women look at you differently. What makes more difference a hunched back but friendly approachable face or a straight posture but you look pissed off? Your posture isnt making those things happen........,False
2074,I think it makes a huge difference. I definitely think I look far more attractive with my chest up,False
2075,The posture is making your headspace more clear,False
2076,Lol what? Your brain isnt getting confused because of your poor posture. You want proof of that just stand at attention and see if you magically start getting peoples attention or have more clarity lol,False
2078,So how about you provide us with a picture of you,False
2079,He followed rules 1 and 2,False
2080,Mate Im 64 and do all of these instructions because i used to be in the fucking army,False
2081,My picture is my profile pic. Maybe it's all just lucky timing,False
2082,You're missing the point. An attractive person who hunches over doesn't display themselves as well as someone with good posture and it is very likely that person would notice a difference if they changed their ways. He's not saying that just because you have good posture you will have good success.,False
2083,Good shit man it's a really big sticking point for me too. It's almost like I've wasted most of my time going out because my posture doesn't allow me to have good eye contact. Along with having a really quiet voice / bad tonality I end up hunching over and it's severely unattractive.,False
2084,Yea,False
2086,Mystrade is a go,False
2089,WE KNOW HIS NAME!,False
2091,I've always loved how Sherlock is often shown devoid of feelings but still ends up subtly expressing them anyway. I like this for a change because he'd be seen as a heartless and unfeeling person,False
2092,I feel the same,False
2093,Yeay for Gavin! (Greg?),False
2094,Wow. I never thought about it like that,False
2095,Welcome to the Sherlock fandom. We over-analyse everything due to staying in constant hiatus limbo,False
2096,Im just happy Greg and Mycroft were in the same place even if it was in Sherlocks mind,False
2097,What are some sexual things you can say to a woman during a cold approach that are not directly explicit but are suggestive and could have a sexual meaning?,False
2099,Funny how writing makes you realize things,False
2100,"put it in my butt""""""",False
2101,"I have toilet paper and if you behave I may give you some hand sanitizer"""" ... I am surprised this actually worked.""",False
2102,Ya like jazz,False
2104,Usually when were at the name exchanging part and they ask for mines,False
2105,My name? Its Hugh Mungus,False
2106,"Hugh """"Rich"""" Mungus""",False
2109,Nice shoes! Shall we dance the night away?,False
2110,Are u from mars? Cause that ass is outta this world,False
2111,You have a beautiful dress/shirt/top,False
2112,Woman lies to her kids,False
2115,And fuck lie detectors...,False
2116,While I don't like lie detectors,False
2118,At the end she says please forgive me HOW THE FUUUUCK COULD YOU DO THAT?! Those women in the back (his daughters) look like they are in their 20s. Imagine having that lie told to you all your childhood and find out that it really is a lie! Redditors  please respond! Would you trust either parent after you found this out?,False
2119,Absolutely disgusting,False
2120,Right would you trust your father or not talk to either?,False
2121,This video must be fake. If current media has taught us anything it is that women never lie about such things for selfish or vindictive reasons. We must always believe ALL women under any circumstances. This has to be some of that new deep fake technology. That man is a sinister and perverted predator. No other conclusion makes sense.,True
2122,My mom didn't go to this extent towards me being raped. She always constantly told me how horrible my real dad is and how much he beat her,False
2123,Why anyone believes anything a females ever says is beyond me.,True
2124,Found the feminist.,False
2125,What they said is exactly how feminists deal with men,False
2126,Be very careful around women.  Avoid them if possible.,True
2127,JuSt bE tHiN!! is complete bsThere are so many ways a body can be ugly,False
2128,Living example of that ,False
2129,lol girl same.,False
2130,being thin is better than being fat as you probably don't get pure hatred. but it may not bring you a bf,False
2132,Yikes,False
2134,r/butterface,False
2135,"Yup. They just keep getting pickier and pickier. It goes from dont be fat -> be thin -> good hip to waist ratio -> long legs -> big butt/breasts -> cellulite and it goes on. A classmate called a girl's birthmark on her arm """"kinda gross"""" one time. And they say women are the shallow ones""",False
2136,just be thin actual translation = jUsT bE slim thicc,False
2137,Also even skin tone,False
2138,So I lost 60lbs and I'm still treated the same and ignored by most men. I can confirm that being thin isn't enough.,False
2139,"reddit moids think that """"unattractive"""" means a chubby young becky who doesn't take care of herself. they genuinely think all women need to do is just """"lose weight"""" because they visually ignore ugly women and can't comprehend that they exist.""",True
2140,Thing is some otherwise attractive people are considered unattractive solely due to weight. In fact some people legit looked unattractive then they lost weight and others were like damn they are actually attractive or at least not ugly.,False
2141,Why isn't the site working?Error 502?,False
2143,Well aren't you nice.,False
2144,r/fuckyoukaren,False
2145,That'd be a great answer if this was the KissAnime subreddit but here in the KissCartoon subreddit,False
2146,It still applies here because it was only the fake ass kiss and kim sites that were down on that day which is why the mods of that sub made that post in the first place cause the sub was getting full spam people bitching about the sites being down.,False
2147,Last minute purchase at the dispensary before the shelter in place,False
2148,Glad I prepped a month ago ,False
2149,The one on Lombard was like this too,False
2151,This is why you grow your own,False
2152,Hope they are buying edibles. Seems to me that smoking anything with a deadly respiratory virus making the rounds is a bad,False
2153,My favourite colossus,False
2154,It do be pretty majestic!,False
2155,Mine as well!,False
2156,Not my fav but up there,False
2157,Shes a cutie! The design is unique and the fight is exhilarating!,False
2158,Big Phalanx,False
